{
  "schema": "ifcn.sequential.paper_benchmark.v1",
  "benchmark_id": "deng2022/sr_majority_latch_1b",
  "module": "sr_majority_latch_1b",
  "classification": {"domain": "sequential", "state_element": "sr_latch", "trigger_model": "level", "bit_width": 1},
  "source": {
    "provenance_status": "primary_source_verified",
    "citation": {
      "key": "deng2022",
      "title": "A general and efficient clocking scheme for majority logic in quantum-dot cellular automata",
      "authors": ["Feifei Deng", "Guangjun Xie", "Xin Cheng", "Yongqiang Zhang"],
      "venue": "Microelectronics Journal 128, 105544",
      "year": 2022,
      "doi": "10.1016/j.mejo.2022.105544",
      "url": "https://www.sciencedirect.com/science/article/pii/S0026269222001744",
      "accessed": "2026-08-24"
    },
    "locator": {"figure": "Fig. 9"},
    "artifact_url": "https://ars.els-cdn.com/content/image/1-s2.0-S0026269222001744-gr9_lrg.jpg",
    "redistribution": "reconstruction_only"
  },
  "reconstruction": {
    "kind": "topology_transcription",
    "source_state_element": "sr_latch",
    "temporal_relation": "same_model",
    "faithfulness_scope": ["truth_table", "io_polarity", "gate_topology"],
    "not_claimed": ["paper cell coordinates", "paper route coordinates", "physical state characterization"],
    "transformations": ["Expressed the Fig. 9 M3(S,~R,Q) feedback as an inferred behavioral latch"],
    "ambiguities": [],
    "assumptions": ["S and R are stable while the majority latch settles"]
  },
  "semantics": {
    "state_element": "sr_latch",
    "clock": {"kind": "level", "clock_domains": 1, "level": "active_high", "logical_clock_abstraction": "There is no logical clock pin; level denotes stable-input evaluation under the paper's four-phase QCA clock zones"},
    "initial_state": "unknown",
    "next_state_equation": "q_next = M(s, ~r, q) = (s & ~r) | (s & q) | (~r & q)",
    "simultaneous_set_reset": "hold",
    "legal_input_contract": "All four S/R combinations are defined; both 00 and 11 hold state",
    "physical_abstraction": "abstract_state_boundary"
  },
  "files": [
    {"role": "rtl", "path": "sr_majority_latch_1b.v", "sha256": "ba779a230c7e6ae981dfe299e620d5a67140274a0b8e08a583933dddd3531ef8"},
    {"role": "truth_table", "path": "expected_transitions.csv", "sha256": "2034135369d2e38d8077026b4e656f3ef9d8922de1355b84f867c990280686e1"}
  ],
  "reported_metrics": [],
  "expected_pipeline": {
    "yosys": {"outcome": "pass", "reason": "Yosys must preserve the inferred latch"},
    "seqir": {"outcome": "reject", "reason": "SeqIR v0 rejects level-sensitive latch cells"},
    "legacy_cut": {"outcome": "not_run", "reason": "The native majority feedback cannot enter the legacy DAG parser"},
    "sequential_pnr": {"outcome": "not_run", "reason": "Native latch/stateful-SCC P&R is not implemented"},
    "mapping": {"outcome": "not_run", "reason": "No characterized majority-latch QCA state macro is available"},
    "physical_state_signoff": "not_characterized"
  },
  "validation": {
    "status": "partially_validated",
    "checks": [
      {"name": "truth_table", "status": "pass", "evidence": "expected_transitions.csv exhausts q/s/r and preserves both hold cases"},
      {"name": "expected_seqir_rejection", "status": "pass", "evidence": "Yosys 0.33 emits $_DLATCH_N_; importer rejects it explicitly"}
    ]
  }
}
