{
  "schema": "ifcn.sequential.paper_benchmark.v1",
  "benchmark_id": "bhowmik2022/d_latch_active_high_1b",
  "module": "d_latch_active_high_1b",
  "classification": {
    "domain": "sequential",
    "state_element": "d_latch",
    "trigger_model": "level",
    "bit_width": 1
  },
  "source": {
    "provenance_status": "primary_source_verified",
    "citation": {
      "key": "bhowmik2022",
      "title": "Regular clocking-based Automated Cell Placement technique in QCA targeting sequential circuit",
      "authors": [
        "Dhrubajyoti Bhowmik",
        "Amit Kumar Pramanik",
        "Jayanta Pal",
        "Pinaki Sen",
        "Ayush Ranjan Singh",
        "Apu Kumar Saha",
        "Bibhash Sen"
      ],
      "venue": "Computers & Electrical Engineering 98, 107668",
      "year": 2022,
      "doi": "10.1016/j.compeleceng.2021.107668",
      "url": "https://www.sciencedirect.com/science/article/pii/S0045790621005905",
      "accessed": "2026-08-24"
    },
    "locator": {"figure": "Fig. 9"},
    "artifact_url": "https://ars.els-cdn.com/content/image/1-s2.0-S0045790621005905-gr9_lrg.jpg",
    "redistribution": "reconstruction_only"
  },
  "reconstruction": {
    "kind": "behavioral_equivalent",
    "source_state_element": "d_latch",
    "temporal_relation": "same_model",
    "faithfulness_scope": ["truth_table", "io_polarity", "clock_semantics", "gate_topology"],
    "not_claimed": ["paper cell coordinates", "paper route coordinates", "physical state characterization"],
    "transformations": ["Expressed the Fig. 9 AND/OR feedback network as an inferred Verilog latch"],
    "ambiguities": ["The paper labels the circuit D flip-flop although Fig. 9 is level-sensitive"],
    "assumptions": ["Inputs are stable while the latch is evaluated"]
  },
  "semantics": {
    "state_element": "d_latch",
    "clock": {
      "kind": "level",
      "clock_domains": 1,
      "level": "active_high",
      "logical_clock_abstraction": "The paper CLOCK pin is a data-level latch enable; QCA still uses a separate four-phase physical clock"
    },
    "initial_state": "unknown",
    "next_state_equation": "q_next = (d & clock) | (q & ~clock)",
    "simultaneous_set_reset": "not_applicable",
    "legal_input_contract": "d and clock are binary and stable during evaluation",
    "physical_abstraction": "abstract_state_boundary"
  },
  "files": [
    {"role": "rtl", "path": "d_latch_active_high_1b.v", "sha256": "5b0e888e866987aa77be4e54a8e4c312abf38a73cf31a4918a21a972b30f11ae"},
    {"role": "truth_table", "path": "expected_transitions.csv", "sha256": "2d4c5ad172a02bf7e37c2652e1e4c0e93e2218a58068491650f4c99517052b4f"}
  ],
  "reported_metrics": [],
  "expected_pipeline": {
    "yosys": {"outcome": "pass", "reason": "Yosys must preserve an inferred level-sensitive latch"},
    "seqir": {"outcome": "reject", "reason": "SeqIR v0 deliberately rejects $_DLATCH cells"},
    "legacy_cut": {"outcome": "not_run", "reason": "A latch cannot be converted to the positive-edge register-cut ABI"},
    "sequential_pnr": {"outcome": "not_run", "reason": "Native latch/stateful-SCC P&R is not implemented"},
    "mapping": {"outcome": "not_run", "reason": "No characterized QCA latch macro is available"},
    "physical_state_signoff": "not_characterized"
  },
  "validation": {
    "status": "partially_validated",
    "checks": [
      {"name": "truth_table", "status": "pass", "evidence": "expected_transitions.csv exhausts all q/clock/d combinations"},
      {"name": "expected_seqir_rejection", "status": "pass", "evidence": "Yosys 0.33 emits $_DLATCH_P_; importer rejects it explicitly"}
    ]
  }
}
